{
  "metadata": {
    "document_title": "BMRS Data Catalogue",
    "document_reference": "BMRS-DC",
    "version": "5.0",
    "effective_from_date": "2025-06-26",
    "status": "LIVE",
    "smart_level": 2,
    "smart_level_notes": "Level 2-3: Machine-readable. Reporting requirements decomposed into discrete items with semantic classification, data provider attribution, temporal scope, granularity, BSC section references, and ontology candidacy. Functional requirements and validation rules extracted as computable clauses. Calculated data items linked to BSC Section T formulae.",
    "parent_code": "Balancing and Settlement Code",
    "bsc_section_reference": "Section V, Section X Annex X-1",
    "copyright_holder": "ELEXON Limited",
    "amendment_history": [
      {
        "version": "1.0",
        "date": "2019-06-27",
        "description": "Creation of Document, P372 June 2019 Release"
      },
      {
        "version": "2.0",
        "date": "2020-02-27",
        "description": "February 2020 Release P394"
      },
      {
        "version": "3.0",
        "date": "2023-11-02",
        "description": "CP1583"
      },
      {
        "version": "4.0",
        "date": "2025-02-24",
        "description": "February 2025 Standard Release P442"
      },
      {
        "version": "5.0",
        "date": "2025-06-26",
        "description": "June 2025 Standard Release P480"
      }
    ],
    "associated_documents": [
      {
        "title": "Service Description for Balancing Mechanism Reporting",
        "relationship": "parent",
        "identifier": "SD-BMR"
      },
      {
        "title": "Balancing Mechanism Reporting Agent User Requirements Specification",
        "relationship": "child",
        "identifier": "BMRA-URS"
      },
      {
        "title": "Reporting Catalogue",
        "relationship": "sibling",
        "identifier": "Reporting-Catalogue"
      },
      {
        "title": "CVA Data Catalogue",
        "relationship": "sibling",
        "identifier": "CVA-DC"
      },
      {
        "title": "SVA Data Catalogue",
        "relationship": "sibling",
        "identifier": "SVA-DC"
      },
      {
        "title": "BSC Section V: Reporting",
        "relationship": "cross-reference",
        "identifier": "BSC-Section-V"
      },
      {
        "title": "BSC Section Q: Balancing Mechanism Activities",
        "relationship": "cross-reference",
        "identifier": "BSC-Section-Q"
      },
      {
        "title": "BSC Section T: Settlement",
        "relationship": "cross-reference",
        "identifier": "BSC-Section-T"
      },
      {
        "title": "BSC Section M: Credit Cover and Credit Default",
        "relationship": "cross-reference",
        "identifier": "BSC-Section-M"
      },
      {
        "title": "Transparency Regulation",
        "relationship": "cross-reference",
        "identifier": "EU-Transparency-Reg"
      }
    ],
    "statistics": {
      "total_reporting_items": 93,
      "calculated_data_items": 26,
      "by_table": {
        "1": 68,
        "2": 19,
        "3": 1,
        "4": 3,
        "5": 1,
        "6": 1
      },
      "by_semantic_type": {
        "measurement": 48,
        "operational": 5,
        "forecast": 6,
        "unclassified": 2,
        "operational_event": 1,
        "financial": 8,
        "reference_data": 3,
        "transparency": 19,
        "regulatory": 1
      },
      "by_data_provider": {
        "NETSO": 83,
        "BMRA (calculated)": 7,
        "BSC Parties (via BMRA)": 1,
        "SAA": 2
      },
      "ontology_candidates": 82,
      "computable_items": 8,
      "functional_rules_extracted": 8
    }
  },
  "acronyms": {
    "BSC": {
      "expansion": "Balancing and Settlement Code",
      "source_code": "BSC",
      "bsc_defined_term": true
    },
    "CVA": {
      "expansion": "Central Volume Allocation",
      "source_code": "BSC",
      "bsc_defined_term": true
    },
    "NETA": {
      "expansion": "New Electricity Trading Arrangements",
      "source_code": "BSC",
      "bsc_defined_term": false
    },
    "IDD": {
      "expansion": "Interface Definition and Design",
      "source_code": "NETA",
      "bsc_defined_term": false
    },
    "NETSO": {
      "expansion": "National Electricity Transmission System Operator",
      "source_code": "BSC",
      "bsc_defined_term": true
    },
    "BMRA": {
      "expansion": "Balancing Mechanism Reporting Agent",
      "source_code": "BSC",
      "bsc_defined_term": true
    },
    "ECVAA": {
      "expansion": "Energy Contract Volume Aggregation Agent",
      "source_code": "BSC",
      "bsc_defined_term": true
    },
    "SAA": {
      "expansion": "Settlement Administration Agent",
      "source_code": "BSC",
      "bsc_defined_term": true
    },
    "CRA": {
      "expansion": "Central Registration Agent",
      "source_code": "BSC",
      "bsc_defined_term": true
    },
    "CDCA": {
      "expansion": "Central Data Collection Agent",
      "source_code": "BSC",
      "bsc_defined_term": true
    },
    "FAA": {
      "expansion": "Funds Administration Agent",
      "source_code": "BSC",
      "bsc_defined_term": true
    },
    "SVAA": {
      "expansion": "Supplier Volume Allocation Agent",
      "source_code": "BSC",
      "bsc_defined_term": true
    },
    "BM": {
      "expansion": "Balancing Mechanism",
      "source_code": "BSC",
      "bsc_defined_term": true
    },
    "GSP": {
      "expansion": "Grid Supply Point",
      "source_code": "BSC",
      "bsc_defined_term": true
    },
    "FPN": {
      "expansion": "Final Physical Notification",
      "source_code": "BSC",
      "bsc_defined_term": true
    },
    "QPN": {
      "expansion": "Quiescent Physical Notification",
      "source_code": "BSC",
      "bsc_defined_term": true
    },
    "PN": {
      "expansion": "Physical Notification",
      "source_code": "BSC",
      "bsc_defined_term": true
    },
    "MEL": {
      "expansion": "Maximum Export Limit",
      "source_code": "BSC",
      "bsc_defined_term": true
    },
    "MIL": {
      "expansion": "Maximum Import Limit",
      "source_code": "BSC",
      "bsc_defined_term": true
    },
    "SEL": {
      "expansion": "Stable Export Limit",
      "source_code": "BSC",
      "bsc_defined_term": true
    },
    "SIL": {
      "expansion": "Stable Import Limit",
      "source_code": "BSC",
      "bsc_defined_term": true
    },
    "MDV": {
      "expansion": "Maximum Delivery Volume",
      "source_code": "BSC",
      "bsc_defined_term": true
    },
    "MDP": {
      "expansion": "Maximum Delivery Period",
      "source_code": "BSC",
      "bsc_defined_term": true
    },
    "MZT": {
      "expansion": "Minimum Zero Time",
      "source_code": "BSC",
      "bsc_defined_term": true
    },
    "MNZT": {
      "expansion": "Minimum Non-Zero Time",
      "source_code": "BSC",
      "bsc_defined_term": true
    },
    "NDZ": {
      "expansion": "Notice to Deviate from Zero",
      "source_code": "BSC",
      "bsc_defined_term": true
    },
    "NTB": {
      "expansion": "Notice to Deliver Bids",
      "source_code": "BSC",
      "bsc_defined_term": true
    },
    "NTO": {
      "expansion": "Notice to Deliver Offers",
      "source_code": "BSC",
      "bsc_defined_term": true
    },
    "ECVN": {
      "expansion": "Energy Contract Volume Notification",
      "source_code": "BSC",
      "bsc_defined_term": true
    },
    "MVRN": {
      "expansion": "Metered Volume Reallocation Notification",
      "source_code": "BSC",
      "bsc_defined_term": true
    },
    "ECVNA": {
      "expansion": "Energy Contract Volume Notification Agent",
      "source_code": "BSC",
      "bsc_defined_term": true
    },
    "ECVNAA": {
      "expansion": "Energy Contract Volume Notification Agent Authorisation",
      "source_code": "BSC",
      "bsc_defined_term": true
    },
    "MVRNA": {
      "expansion": "Metered Volume Reallocation Notification Agent",
      "source_code": "BSC",
      "bsc_defined_term": true
    },
    "MVRNAA": {
      "expansion": "Metered Volume Reallocation Notification Agent Authorisation",
      "source_code": "BSC",
      "bsc_defined_term": true
    },
    "NIV": {
      "expansion": "Net Imbalance Volume",
      "source_code": "BSC",
      "bsc_defined_term": true
    },
    "PAR": {
      "expansion": "Price Average Reference",
      "source_code": "BSC",
      "bsc_defined_term": true
    },
    "NGC": {
      "expansion": "National Grid Company",
      "source_code": "Grid Code",
      "bsc_defined_term": false
    },
    "NDFC": {
      "expansion": "NGC Data File Catalogue",
      "source_code": "Grid Code",
      "bsc_defined_term": false
    },
    "EDT01": {
      "expansion": "Electronic Data Transfer file reference 01 (NETSO to BMRA)",
      "source_code": "NETA IDD",
      "bsc_defined_term": false
    },
    "BSAD": {
      "expansion": "Balancing Services Adjustment Data",
      "source_code": "BSC",
      "bsc_defined_term": true
    },
    "RR": {
      "expansion": "Replacement Reserve",
      "source_code": "BSC/EU TERRE",
      "bsc_defined_term": true
    },
    "TERRE": {
      "expansion": "Trans European Replacement Reserves Exchange",
      "source_code": "EU Regulation",
      "bsc_defined_term": false
    },
    "STOR": {
      "expansion": "Short Term Operating Reserve",
      "source_code": "Grid Code/BSC",
      "bsc_defined_term": false
    },
    "CADL": {
      "expansion": "Continuous Acceptance Duration Limit",
      "source_code": "BSC",
      "bsc_defined_term": true
    },
    "ESNA": {
      "expansion": "Exempt Supplier Notification Agent",
      "source_code": "BSC",
      "bsc_defined_term": true
    },
    "MPAN": {
      "expansion": "Meter Point Administration Number",
      "source_code": "MRA/Distribution Code",
      "bsc_defined_term": false
    },
    "REMIT": {
      "expansion": "Regulation on Energy Market Integrity and Transparency",
      "source_code": "EU Regulation",